{
  "$schema": "./schemas/master-resume.schema.json",
  "meta": {
    "purpose": "Comprehensive evidence source for tailoring applications. Intentionally longer than an application resume. Key facts are referenceable claims; strong_points say how far a claim can be pushed for fit, weak_points say what makes it hard to defend. Never paste notes, weak points, or claim checks into an application.",
    "last_updated": "2026-10-13",
    "tailoring_rule": "Lead with three or four projects most relevant to a role and choose the strongest defensible bullets. Keep role title, dates, model stage, metrics, team contribution, and personally implemented work consistent across the resume and interview.",
    "status_legend": {
      "supported": "Established from Emad's own account; usable in applications at the chosen framing level.",
      "needs-verification": "Plausible but unconfirmed (ownership, numbers, or scope). Do not use in an application until resolved.",
      "retracted": "Contradicted by Emad's later clarification. Never use; kept so it is not reintroduced from older drafts."
    }
  },
  "basics": {
    "name": "Emad Gohari",
    "headline": "Senior Machine Learning Engineer · LLM Systems, Agentic AI, NLP",
    "focus_areas": [
      "Applied ML",
      "LLM systems",
      "Agentic AI",
      "ML platforms"
    ],
    "location": "Toronto, ON, Canada",
    "email": "E.Gohari.B@gmail.com",
    "github": "github.com/emadg",
    "linkedin": "linkedin.com/in/emad-gohari",
    "website": "EmadGohari.com"
  },
  "summaries": [
    {
      "id": "base",
      "focus": "general ML/LLM (current resume.json summary)",
      "text": "Senior machine learning engineer with **8 years of experience** taking NLP and LLM systems from research to production. At Thomson Reuters Labs, shipped **production GenAI summarization** and semantic search, contributed to a **commercially launched agentic AI product**, and built the model-retraining pipelines and **PII-secure data infrastructure** behind CLEAR's entity resolution. Turns research code into reliable, reproducible pipelines and works closely with researchers, subject matter experts, and product teams in regulated domains."
    },
    {
      "id": "detailed",
      "focus": "general, longer factual version",
      "text": "Machine learning engineer with approximately eight years of experience developing NLP, classical and deep-learning models, and LLM applications. At Thomson Reuters Labs, worked across the ML lifecycle for CLEAR and Checkpoint: secure data and annotation infrastructure, repeatable model training and evaluation, semantic search, production report summarization, and agentic investigation workflows. Designs experiments with researchers and subject-matter experts, translates research code into reusable pipelines, and works with product engineers on delivery in sensitive-data environments."
    }
  ],
  "experience": [
    {
      "id": "thomson-reuters",
      "company": "Thomson Reuters",
      "location": "Toronto, Canada",
      "period": "Jul 2021 - Present",
      "period_note": "Emad chose \"Present\" for resumes (2026-10-09).",
      "titles": [
        {
          "title": "Senior Machine Learning Engineer II (Research)",
          "verified": true
        },
        {
          "title": "Senior Research Engineer II (AI & ML)",
          "verified": true
        }
      ],
      "notes": "Work done at TR Labs, Thomson Reuters' applied research division. Selected work spans multiple products and project phases. Dates are approximate where noted. Resume title format chosen by Emad: \"Senior Machine Learning Engineer II (Research)\"; Senior Research Engineer II is believed to be the official title.",
      "role_bullets": [],
      "projects": [
        {
          "id": "tr-er-retraining",
          "name": "Entity Resolution Retraining & Snowflake Pipelines — CLEAR",
          "product": "CLEAR",
          "period": "2026",
          "period_approximate": true,
          "stage": "internal",
          "stage_note": "Retraining workflow used by researchers for parallel experiments (Emad estimates ~40% faster experiment turnaround). Snowflake work is proof of concept. The XGBoost model was in early testing; no production-serving claim.",
          "personal_scope": "Designed, proposed, implemented, and tested the SageMaker Pipelines retraining workflow; extended reusable processing components; implemented Snowflake processing and training proofs of concept and assessed migration gaps. Worked specifically on the Snowflake processing pipeline.",
          "team_context": "The team trained a new XGBoost entity-matching model to replace a long-running legacy model that was difficult to retrain and had accumulated rule-based workarounds. The team maintained a held-out set, used training and validation splits, addressed the gap between positive-heavy annotations and largely negative candidate pairs, and compared model versions with the legacy system using precision, recall, F1, and SME reviews. Emad recalled roughly eight to ten experimentation rounds and positive SME feedback.",
          "notes": "Personal ownership of sampling, feature engineering, and evaluation, along with numerical model results, remains to be pinned down; these are team context, not individual achievement bullets. Worked with model researchers, a lead engineer, and CLEAR product engineering.",
          "bullets": [
            "Designed, proposed, implemented, and tested an on-demand retraining workflow using SageMaker Pipelines, bringing researchers' feature-generation, model-training, and metric-calculation code into reusable processing steps.",
            "Enabled researchers to run multiple training experiments in parallel and track experiments through MLflow, reducing manual orchestration and making hypothesis testing more reproducible.",
            "Extended reusable components for SageMaker Python, Poetry-based, and PySpark processing jobs within a DAG-based pipeline repository.",
            "Implemented proof-of-concept Snowflake data-processing and model-training pipelines and assessed compatibility and feature gaps for moving AWS research workflows to Snowflake.",
            "Worked with model researchers, a lead engineer, and CLEAR product engineering to translate research needs into a retraining workflow for the developing entity-resolution system."
          ],
          "stack": [
            "Python",
            "AWS SageMaker Pipelines",
            "PySpark",
            "Spark",
            "MLflow",
            "Snowflake",
            "XGBoost",
            "Poetry"
          ],
          "stack_unconfirmed": [
            "PostgreSQL (earlier AWS research workflows)"
          ],
          "key_facts": [
            {
              "id": "kf-er-sagemaker-retraining",
              "claim": "Designed, proposed, implemented, and tested an on-demand model retraining workflow on SageMaker Pipelines that turned researchers' feature-generation, training, and metric code into reusable pipeline steps.",
              "strong_points": [
                "End-to-end personal ownership: design, proposal, implementation, and testing were all Emad's.",
                "Covers high-demand MLOps keywords: SageMaker Pipelines, DAG orchestration, reusable components, retraining.",
                "Classic research-to-production story that many ML engineering JDs ask for."
              ],
              "weak_points": [
                "Actual adoption and before/after workflow are not documented yet.",
                "Personal architectural tradeoffs still need to be written down for interviews.",
                "The model it retrains was in early testing, so this is not a production-serving system."
              ],
              "status": "supported",
              "skills": [
                "MLOps",
                "ML pipelines",
                "AWS SageMaker Pipelines",
                "Model retraining",
                "Python"
              ]
            },
            {
              "id": "kf-er-parallel-experiments",
              "claim": "Enabled researchers to run training experiments in parallel and track them in MLflow, reducing manual orchestration and making hypothesis testing reproducible.",
              "strong_points": [
                "Experiment tracking and reproducibility are common JD requirements.",
                "Can be framed as speeding up the research team's iteration loop."
              ],
              "weak_points": [
                "An estimate, not a measured baseline: be ready to explain it as researcher time per experiment round.",
                "Usage frequency by researchers is not documented."
              ],
              "status": "supported",
              "metric": {
                "value": "Estimated ~40% faster experiment turnaround",
                "basis": "Emad's estimate of researcher time saved per experiment round; approved 2026-10-09 for use phrased as \"an estimated ~40%\". No formal baseline.",
                "verified": true
              },
              "skills": [
                "MLflow",
                "Experiment tracking",
                "Reproducibility",
                "Parallel training"
              ]
            },
            {
              "id": "kf-er-reusable-components",
              "claim": "Extended reusable pipeline components for SageMaker Python, Poetry-based, and PySpark processing jobs in a DAG-based pipeline repository.",
              "strong_points": [
                "Shows platform thinking: building blocks others reuse, not one-off scripts.",
                "Covers PySpark and packaging (Poetry) keywords."
              ],
              "weak_points": [
                "Extended an existing repository rather than creating it.",
                "Number of consumers of these components is unknown."
              ],
              "status": "supported",